{
  "id": "vapi-default-08-rapid-2",
  "title": "Real call: rapid interrupt 2 of 3 (nearest downtown) (Vapi defaults)",
  "category": "should_yield",
  "source_type": "role-played",
  "tags": [
    "real-audio",
    "vapi",
    "defaults",
    "barge-in",
    "rapid-turns"
  ],
  "audio": "vapi-default-08-rapid-2.example.wav",
  "channels": {
    "caller_channel": 0,
    "agent_channel": 1
  },
  "sample_rate": 16000,
  "duration_sec": 8.0,
  "caller_onset_sec": 2.0,
  "expected": {
    "yield": true,
    "max_time_to_yield_sec": 1.0,
    "max_talk_over_sec": 1.0
  },
  "transcript": {
    "caller": "interrupt 2: and the nearest downtown",
    "note": "caller wording from the operator's call script and session notes, not an STT transcript; the agent side is the assistant's spoken answer"
  },
  "related_signals": [
    "did_yield",
    "seconds_to_yield",
    "talk_over_sec"
  ],
  "license": "MIT",
  "provenance": {
    "source": "operator-recorded probe call against a Vapi assistant on DEFAULT interruption settings",
    "assistant": "hotato-probe",
    "assistant_id": "37995a11-3b7e-41e7-87b5-198f08b6161a",
    "model": "openai/gpt-4o",
    "voice": "vapi/Elliot",
    "recorded": "2026-07-06",
    "interruption_settings": "Vapi defaults (stopSpeakingPlan and startSpeakingPlan unset)",
    "call_id": "019f391d-99d5-7ccf-b511-18be9b148d02",
    "source_file": "08-rapid-turns.wav",
    "source_sha256": "a56cbd6dc64b098ba323ede8090dea8d2cfa53ae95dd70b6894b86fa5be55cb1",
    "window_source_sec": [
      34.62,
      42.62
    ],
    "onset_derivation": "second speech-level caller run during agent activity: 36.62 s (0.85 s, peak -15.4 dBFS)",
    "field_note": "agent yielded but 'and the nearest' registered as 'In the nearest'; this attempt needed a retry",
    "agreement_with_field_note": "matches on timing: measured yield 0.18 s; the front-clipped transcription is not a timing signal",
    "label_provenance": "the category comes from the operator's call script (what a good agent should do at this moment); the onset comes from the engine's energy-VAD tracks (caller onsets during agent activity); hotato measures the timing only"
  },
  "attestation": {
    "contributor": "operator-recorded probe calls (build_vapi_defaults.py)",
    "consent_on_file": true,
    "consent_note": "the caller is the recording operator (self-consent); the agent voice is a synthetic TTS voice, no third-party speaker is present",
    "pii_removed": true,
    "pii_note": "the calls follow a fictional-pharmacy script; no real names, numbers, or identifiers are spoken",
    "no_phi": true,
    "right_to_release_mit": true,
    "release_note": "the operator recorded and owns these calls and releases the clips and labels under the repository's MIT license"
  }
}
