{
  "id": "vapi-default-01-hard-interruption",
  "title": "Real call: loud hard interruption mid-paragraph (Vapi defaults)",
  "category": "should_yield",
  "source_type": "role-played",
  "tags": [
    "real-audio",
    "vapi",
    "defaults",
    "barge-in",
    "hard-interruption"
  ],
  "audio": "vapi-default-01-hard-interruption.example.wav",
  "channels": {
    "caller_channel": 0,
    "agent_channel": 1
  },
  "sample_rate": 16000,
  "duration_sec": 8.0,
  "caller_onset_sec": 2.0,
  "expected": {
    "yield": true,
    "max_time_to_yield_sec": 1.0,
    "max_talk_over_sec": 1.0
  },
  "transcript": {
    "caller": "loud cut-in mid-paragraph during the hours answer",
    "note": "caller wording from the operator's call script and session notes, not an STT transcript; the agent side is the assistant's spoken answer"
  },
  "related_signals": [
    "did_yield",
    "seconds_to_yield",
    "talk_over_sec"
  ],
  "license": "MIT",
  "provenance": {
    "source": "operator-recorded probe call against a Vapi assistant on DEFAULT interruption settings",
    "assistant": "hotato-probe",
    "assistant_id": "37995a11-3b7e-41e7-87b5-198f08b6161a",
    "model": "openai/gpt-4o",
    "voice": "vapi/Elliot",
    "recorded": "2026-07-06",
    "interruption_settings": "Vapi defaults (stopSpeakingPlan and startSpeakingPlan unset)",
    "call_id": "019f3905-f5cb-7991-a4b3-e45b8606b631",
    "source_file": "01-hard-interruption.wav",
    "source_sha256": "a763be90faf4fbebff4e5228f42eb58dba23d0bee2c6bc03b4a153c994816bfe",
    "window_source_sec": [
      19.41,
      27.41
    ],
    "onset_derivation": "the only caller-active run that starts during agent activity on this call: 21.41 s, 2.06 s long, peak -17.7 dBFS; matches the scripted loud cut-in",
    "field_note": "agent yielded to the interruption",
    "agreement_with_field_note": "matches: measured yield 0.20 s after onset",
    "label_provenance": "the category comes from the operator's call script (what a good agent should do at this moment); the onset comes from the engine's energy-VAD tracks (caller onsets during agent activity); hotato measures the timing only"
  },
  "attestation": {
    "contributor": "operator-recorded probe calls (build_vapi_defaults.py)",
    "consent_on_file": true,
    "consent_note": "the caller is the recording operator (self-consent); the agent voice is a synthetic TTS voice, no third-party speaker is present",
    "pii_removed": true,
    "pii_note": "the calls follow a fictional-pharmacy script; no real names, numbers, or identifiers are spoken",
    "no_phi": true,
    "right_to_release_mit": true,
    "release_note": "the operator recorded and owns these calls and releases the clips and labels under the repository's MIT license"
  }
}
