{
  "id": "vapi-default-08-rapid-3",
  "title": "Real call: rapid interrupt 3 of 3 (what about parking) (Vapi defaults)",
  "category": "should_yield",
  "source_type": "role-played",
  "tags": [
    "real-audio",
    "vapi",
    "defaults",
    "barge-in",
    "rapid-turns"
  ],
  "audio": "vapi-default-08-rapid-3.example.wav",
  "channels": {
    "caller_channel": 0,
    "agent_channel": 1
  },
  "sample_rate": 16000,
  "duration_sec": 8.0,
  "caller_onset_sec": 2.0,
  "expected": {
    "yield": true,
    "max_time_to_yield_sec": 1.0,
    "max_talk_over_sec": 1.0
  },
  "transcript": {
    "caller": "interrupt 3: and what about parking",
    "note": "caller wording from the operator's call script and session notes, not an STT transcript; the agent side is the assistant's spoken answer"
  },
  "related_signals": [
    "did_yield",
    "seconds_to_yield",
    "talk_over_sec"
  ],
  "license": "MIT",
  "provenance": {
    "source": "operator-recorded probe call against a Vapi assistant on DEFAULT interruption settings",
    "assistant": "hotato-probe",
    "assistant_id": "37995a11-3b7e-41e7-87b5-198f08b6161a",
    "model": "openai/gpt-4o",
    "voice": "vapi/Elliot",
    "recorded": "2026-07-06",
    "interruption_settings": "Vapi defaults (stopSpeakingPlan and startSpeakingPlan unset)",
    "call_id": "019f391d-99d5-7ccf-b511-18be9b148d02",
    "source_file": "08-rapid-turns.wav",
    "source_sha256": "a56cbd6dc64b098ba323ede8090dea8d2cfa53ae95dd70b6894b86fa5be55cb1",
    "window_source_sec": [
      64.18,
      72.18
    ],
    "onset_derivation": "the landed third interrupt: 66.18 s (0.75 s, peak -13.8 dBFS), starting as the agent's 64.16 to 66.12 s run ends (inside the engine's 0.10 s lookback, so the agent counts as talking at onset); an earlier sub-speech blip at 61.64 s (peak -47.7 dBFS) is consistent with the operator's 'needed about 3 attempts'",
    "field_note": "agent yielded; 'and what about parking' registered as just 'parking' after about 3 attempts",
    "agreement_with_field_note": "matches on timing: the agent was quiet at the onset frame (seconds_to_yield 0.0); the dropped leading words are a transcription artifact",
    "label_provenance": "the category comes from the operator's call script (what a good agent should do at this moment); the onset comes from the engine's energy-VAD tracks (caller onsets during agent activity); hotato measures the timing only"
  },
  "attestation": {
    "contributor": "operator-recorded probe calls (build_vapi_defaults.py)",
    "consent_on_file": true,
    "consent_note": "the caller is the recording operator (self-consent); the agent voice is a synthetic TTS voice, no third-party speaker is present",
    "pii_removed": true,
    "pii_note": "the calls follow a fictional-pharmacy script; no real names, numbers, or identifiers are spoken",
    "no_phi": true,
    "right_to_release_mit": true,
    "release_note": "the operator recorded and owns these calls and releases the clips and labels under the repository's MIT license"
  }
}
