{
  "id": "vapi-default-02-one-word-stop",
  "title": "Real call: a single firm 'Stop.' mid-paragraph (Vapi defaults)",
  "category": "should_yield",
  "source_type": "role-played",
  "tags": [
    "real-audio",
    "vapi",
    "defaults",
    "barge-in",
    "short-command",
    "missed-interruption"
  ],
  "audio": "vapi-default-02-one-word-stop.example.wav",
  "channels": {
    "caller_channel": 0,
    "agent_channel": 1
  },
  "sample_rate": 16000,
  "duration_sec": 8.0,
  "caller_onset_sec": 2.0,
  "expected": {
    "yield": true,
    "max_time_to_yield_sec": 1.0,
    "max_talk_over_sec": 1.0
  },
  "transcript": {
    "caller": "Stop.",
    "note": "caller wording from the operator's call script and session notes, not an STT transcript; the agent side is the assistant's spoken answer"
  },
  "related_signals": [
    "did_yield",
    "seconds_to_yield",
    "talk_over_sec"
  ],
  "license": "MIT",
  "provenance": {
    "source": "operator-recorded probe call against a Vapi assistant on DEFAULT interruption settings",
    "assistant": "hotato-probe",
    "assistant_id": "37995a11-3b7e-41e7-87b5-198f08b6161a",
    "model": "openai/gpt-4o",
    "voice": "vapi/Elliot",
    "recorded": "2026-07-06",
    "interruption_settings": "Vapi defaults (stopSpeakingPlan and startSpeakingPlan unset)",
    "call_id": "019f390a-7293-7332-bc2d-f3e289d92a7e",
    "source_file": "02-one-word-stop.wav",
    "source_sha256": "fb50e4c85c4571ad752d48e0a6d0f1f59dca9b44229f57f396835d80bcea84d2",
    "window_source_sec": [
      45.6,
      53.6
    ],
    "onset_derivation": "speech-level caller runs during agent activity: 47.60 s (0.45 s, peak -26.7 dBFS) is the scripted 'Stop.' during the agent's paragraph; a second caller burst at 49.48 s (0.38 s, peak -25.9 dBFS) falls in an agent inter-sentence gap; three sub -47 dBFS blips (20.72, 43.97, 62.02 s) are below speech level",
    "field_note": "agent did NOT yield to the 'Stop.'; it kept talking and then restarted its paragraph",
    "agreement_with_field_note": "investigated disagreement on the binary: hotato measures did_yield=true at 1.46 s because the agent's own inter-sentence gap (48.86 to 49.49 s) coincides with the second caller burst at 49.48 s; the agent then spoke again at 49.49 s and restarted the whole paragraph at 51.24 s (an 8.7 s re-answer). The 1.46 s seconds_to_yield fails the stated 1.0 s bound, so the verdict is FAIL either way; a resume/restart signal is outside the current measurement set and is documented in RESULTS.md",
    "label_provenance": "the category comes from the operator's call script (what a good agent should do at this moment); the onset comes from the engine's energy-VAD tracks (caller onsets during agent activity); hotato measures the timing only"
  },
  "attestation": {
    "contributor": "operator-recorded probe calls (build_vapi_defaults.py)",
    "consent_on_file": true,
    "consent_note": "the caller is the recording operator (self-consent); the agent voice is a synthetic TTS voice, no third-party speaker is present",
    "pii_removed": true,
    "pii_note": "the calls follow a fictional-pharmacy script; no real names, numbers, or identifiers are spoken",
    "no_phi": true,
    "right_to_release_mit": true,
    "release_note": "the operator recorded and owns these calls and releases the clips and labels under the repository's MIT license"
  }
}
