{
  "id": "vapi-default-05-hold-on",
  "title": "Real call: loud 'wait, actually, hold on', moment 2 of 2 (Vapi defaults)",
  "category": "should_yield",
  "source_type": "role-played",
  "tags": [
    "real-audio",
    "vapi",
    "defaults",
    "barge-in",
    "dual-moment"
  ],
  "audio": "vapi-default-05-hold-on.example.wav",
  "channels": {
    "caller_channel": 0,
    "agent_channel": 1
  },
  "sample_rate": 16000,
  "duration_sec": 8.0,
  "caller_onset_sec": 2.0,
  "expected": {
    "yield": true,
    "max_time_to_yield_sec": 1.0,
    "max_talk_over_sec": 1.0
  },
  "transcript": {
    "caller": "wait, actually, hold on",
    "note": "caller wording from the operator's call script and session notes, not an STT transcript; the agent side is the assistant's spoken answer"
  },
  "related_signals": [
    "did_yield",
    "seconds_to_yield",
    "talk_over_sec"
  ],
  "license": "MIT",
  "provenance": {
    "source": "operator-recorded probe call against a Vapi assistant on DEFAULT interruption settings",
    "assistant": "hotato-probe",
    "assistant_id": "37995a11-3b7e-41e7-87b5-198f08b6161a",
    "model": "openai/gpt-4o",
    "voice": "vapi/Elliot",
    "recorded": "2026-07-06",
    "interruption_settings": "Vapi defaults (stopSpeakingPlan and startSpeakingPlan unset)",
    "call_id": "019f3912-986f-7dde-aba3-adc528d42266",
    "source_file": "05-backchannel-then-real-interrupt.wav",
    "source_sha256": "dcfff0416f678dbe5ceca997fb81e402a551709a76d040bb672c8df9e2b84ac4",
    "window_source_sec": [
      24.27,
      32.27
    ],
    "onset_derivation": "second scripted moment: caller bursts at 26.27, 26.67 and 27.32 s (the multi-word interruption); onset is the first burst, which starts during the agent's 19.67 to 26.63 s run",
    "field_note": "agent CORRECTLY yielded and acknowledged ('Of course. Take your time...')",
    "agreement_with_field_note": "matches: measured yield 0.21 s after onset",
    "label_provenance": "the category comes from the operator's call script (what a good agent should do at this moment); the onset comes from the engine's energy-VAD tracks (caller onsets during agent activity); hotato measures the timing only"
  },
  "attestation": {
    "contributor": "operator-recorded probe calls (build_vapi_defaults.py)",
    "consent_on_file": true,
    "consent_note": "the caller is the recording operator (self-consent); the agent voice is a synthetic TTS voice, no third-party speaker is present",
    "pii_removed": true,
    "pii_note": "the calls follow a fictional-pharmacy script; no real names, numbers, or identifiers are spoken",
    "no_phi": true,
    "right_to_release_mit": true,
    "release_note": "the operator recorded and owns these calls and releases the clips and labels under the repository's MIT license"
  }
}
