{
  "id": "vapi-default-12-greeting-overlap",
  "title": "Real call: barge-in over the greeting itself (Vapi defaults)",
  "category": "should_yield",
  "source_type": "role-played",
  "tags": [
    "real-audio",
    "vapi",
    "defaults",
    "barge-in",
    "greeting-overlap"
  ],
  "audio": "vapi-default-12-greeting-overlap.example.wav",
  "channels": {
    "caller_channel": 0,
    "agent_channel": 1
  },
  "sample_rate": 16000,
  "duration_sec": 8.0,
  "caller_onset_sec": 2.0,
  "expected": {
    "yield": true,
    "max_time_to_yield_sec": 1.0,
    "max_talk_over_sec": 1.0
  },
  "transcript": {
    "caller": "barge-in over the agent's greeting",
    "note": "caller wording from the operator's call script and session notes, not an STT transcript; the agent side is the assistant's spoken answer"
  },
  "related_signals": [
    "did_yield",
    "seconds_to_yield",
    "talk_over_sec"
  ],
  "license": "MIT",
  "provenance": {
    "source": "operator-recorded probe call against a Vapi assistant on DEFAULT interruption settings",
    "assistant": "hotato-probe",
    "assistant_id": "37995a11-3b7e-41e7-87b5-198f08b6161a",
    "model": "openai/gpt-4o",
    "voice": "vapi/Elliot",
    "recorded": "2026-07-06",
    "interruption_settings": "Vapi defaults (stopSpeakingPlan and startSpeakingPlan unset)",
    "call_id": "019f3931-af2c-7229-b12d-bd37e4a937db",
    "source_file": "12-immediate-overlap.wav",
    "source_sha256": "956cac295bfa7e58b9046bc18ce9e83249a195c3ddf48a658b27f172d87b99dc",
    "window_source_sec": [
      4.48,
      12.48
    ],
    "onset_derivation": "the caller run starting during agent activity: 6.48 s (0.88 s, peak -21.8 dBFS) over the agent's 5.69 to 6.85 s greeting continuation; the caller's 2.57 s run precedes any agent speech activity in that window and is the operator opening the call",
    "field_note": "agent yielded over its own greeting and responded, though STT caught only a partial ('I need help with it')",
    "agreement_with_field_note": "matches on timing: measured yield 0.22 s; the partial transcription is not a timing signal",
    "label_provenance": "the category comes from the operator's call script (what a good agent should do at this moment); the onset comes from the engine's energy-VAD tracks (caller onsets during agent activity); hotato measures the timing only"
  },
  "attestation": {
    "contributor": "operator-recorded probe calls (build_vapi_defaults.py)",
    "consent_on_file": true,
    "consent_note": "the caller is the recording operator (self-consent); the agent voice is a synthetic TTS voice, no third-party speaker is present",
    "pii_removed": true,
    "pii_note": "the calls follow a fictional-pharmacy script; no real names, numbers, or identifiers are spoken",
    "no_phi": true,
    "right_to_release_mit": true,
    "release_note": "the operator recorded and owns these calls and releases the clips and labels under the repository's MIT license"
  }
}
