{
  "id": "vapi-default-10-quiet-retry",
  "title": "Real call: the louder retry after the ignored quiet interrupt (Vapi defaults)",
  "category": "should_yield",
  "source_type": "role-played",
  "tags": [
    "real-audio",
    "vapi",
    "defaults",
    "barge-in",
    "quiet-interruption"
  ],
  "audio": "vapi-default-10-quiet-retry.example.wav",
  "channels": {
    "caller_channel": 0,
    "agent_channel": 1
  },
  "sample_rate": 16000,
  "duration_sec": 7.73,
  "caller_onset_sec": 2.0,
  "expected": {
    "yield": true,
    "max_time_to_yield_sec": 1.0,
    "max_talk_over_sec": 1.0
  },
  "transcript": {
    "caller": "sorry, one second (about 30 to 40 percent louder)",
    "note": "caller wording from the operator's call script and session notes, not an STT transcript; the agent side is the assistant's spoken answer"
  },
  "related_signals": [
    "did_yield",
    "seconds_to_yield",
    "talk_over_sec"
  ],
  "license": "MIT",
  "provenance": {
    "source": "operator-recorded probe call against a Vapi assistant on DEFAULT interruption settings",
    "assistant": "hotato-probe",
    "assistant_id": "37995a11-3b7e-41e7-87b5-198f08b6161a",
    "model": "openai/gpt-4o",
    "voice": "vapi/Elliot",
    "recorded": "2026-07-06",
    "interruption_settings": "Vapi defaults (stopSpeakingPlan and startSpeakingPlan unset)",
    "call_id": "019f3929-9f73-7227-b1a8-2dfdf287c88c",
    "source_file": "10-quiet-interruption.wav",
    "source_sha256": "01b61e3069b9e5372bd9bb0c0b69b1558abc66ab40f974c721f028e054d9046e",
    "window_source_sec": [
      17.27,
      25.0
    ],
    "onset_derivation": "the louder retry: 19.27 s (0.59 s, peak -26.5 dBFS) during the agent's 19.14 to 19.87 s run; this is the attempt the agent finally yielded to",
    "field_note": "after raising volume 30 to 40 percent a garbled fragment registered and the agent yielded",
    "agreement_with_field_note": "matches: measured yield 0.45 s after the retry onset",
    "label_provenance": "the category comes from the operator's call script (what a good agent should do at this moment); the onset comes from the engine's energy-VAD tracks (caller onsets during agent activity); hotato measures the timing only"
  },
  "attestation": {
    "contributor": "operator-recorded probe calls (build_vapi_defaults.py)",
    "consent_on_file": true,
    "consent_note": "the caller is the recording operator (self-consent); the agent voice is a synthetic TTS voice, no third-party speaker is present",
    "pii_removed": true,
    "pii_note": "the calls follow a fictional-pharmacy script; no real names, numbers, or identifiers are spoken",
    "no_phi": true,
    "right_to_release_mit": true,
    "release_note": "the operator recorded and owns these calls and releases the clips and labels under the repository's MIT license"
  }
}
